{
  "schemaVersion": "arena-manifest-001",
  "arenaVersion": "civic-seam-arena-002",
  "cellSizeUnits": 64,
  "gridSizeCells": {
    "width": 36,
    "height": 24
  },
  "boundsUnits": {
    "minX": 0,
    "minY": 0,
    "maxX": 2304,
    "maxY": 1536
  },
  "standardCameraGeometry": {
    "mountCollisionRadiusUnits": 12,
    "hitRadiusUnits": 16,
    "fieldOriginOffset": {
      "x": 0,
      "y": 18
    },
    "targetAnchorOffset": {
      "x": 0,
      "y": 16
    }
  },
  "playerSpawn": {
    "x": 160,
    "y": 192,
    "headingMilliDegrees": 0
  },
  "zones": [
    {
      "id": "Z-01",
      "name": "Residential Wedge",
      "center": {
        "x": 224,
        "y": 256
      },
      "halfSize": {
        "x": 160,
        "y": 192
      }
    },
    {
      "id": "Z-02",
      "name": "Transit Cut",
      "center": {
        "x": 576,
        "y": 448
      },
      "halfSize": {
        "x": 256,
        "y": 256
      }
    },
    {
      "id": "Z-03",
      "name": "Civic Plaza",
      "center": {
        "x": 1024,
        "y": 640
      },
      "halfSize": {
        "x": 256,
        "y": 256
      }
    },
    {
      "id": "Z-04",
      "name": "Service Seam",
      "center": {
        "x": 1376,
        "y": 1088
      },
      "halfSize": {
        "x": 288,
        "y": 320
      }
    },
    {
      "id": "Z-05",
      "name": "Grid Junction",
      "center": {
        "x": 1728,
        "y": 832
      },
      "halfSize": {
        "x": 256,
        "y": 256
      }
    },
    {
      "id": "Z-06",
      "name": "Authority Court",
      "center": {
        "x": 2048,
        "y": 640
      },
      "halfSize": {
        "x": 192,
        "y": 256
      }
    },
    {
      "id": "Z-07",
      "name": "Phoenix Steps",
      "center": {
        "x": 2048,
        "y": 224
      },
      "halfSize": {
        "x": 192,
        "y": 128
      }
    }
  ],
  "permanentSolids": [
    {
      "id": "solid-01-residential-west",
      "center": {
        "x": 64,
        "y": 640
      },
      "halfSize": {
        "x": 64,
        "y": 256
      }
    },
    {
      "id": "solid-02-residential-north",
      "center": {
        "x": 320,
        "y": 864
      },
      "halfSize": {
        "x": 192,
        "y": 96
      }
    },
    {
      "id": "solid-03-transit-kiosk",
      "center": {
        "x": 576,
        "y": 704
      },
      "halfSize": {
        "x": 64,
        "y": 64
      }
    },
    {
      "id": "solid-04-civic-west",
      "center": {
        "x": 832,
        "y": 960
      },
      "halfSize": {
        "x": 96,
        "y": 192
      }
    },
    {
      "id": "solid-05-civic-dais",
      "center": {
        "x": 1088,
        "y": 704
      },
      "halfSize": {
        "x": 80,
        "y": 48
      }
    },
    {
      "id": "solid-06-service-yard-a",
      "center": {
        "x": 1152,
        "y": 1248
      },
      "halfSize": {
        "x": 96,
        "y": 160
      }
    },
    {
      "id": "solid-07-service-yard-b",
      "center": {
        "x": 1536,
        "y": 1344
      },
      "halfSize": {
        "x": 128,
        "y": 96
      }
    },
    {
      "id": "solid-08-service-divider",
      "center": {
        "x": 1408,
        "y": 960
      },
      "halfSize": {
        "x": 48,
        "y": 112
      }
    },
    {
      "id": "solid-09-grid-island-a",
      "center": {
        "x": 1600,
        "y": 704
      },
      "halfSize": {
        "x": 64,
        "y": 64
      }
    },
    {
      "id": "solid-10-grid-island-b",
      "center": {
        "x": 1792,
        "y": 960
      },
      "halfSize": {
        "x": 64,
        "y": 64
      }
    },
    {
      "id": "solid-11-court-column-a",
      "center": {
        "x": 1920,
        "y": 704
      },
      "halfSize": {
        "x": 32,
        "y": 72
      }
    },
    {
      "id": "solid-12-court-column-b",
      "center": {
        "x": 2176,
        "y": 704
      },
      "halfSize": {
        "x": 32,
        "y": 72
      }
    },
    {
      "id": "solid-13-phoenix-west",
      "center": {
        "x": 1856,
        "y": 192
      },
      "halfSize": {
        "x": 32,
        "y": 128
      }
    },
    {
      "id": "solid-14-phoenix-east",
      "center": {
        "x": 2240,
        "y": 192
      },
      "halfSize": {
        "x": 32,
        "y": 128
      }
    }
  ],
  "gates": [
    {
      "id": "gate-ma-forward",
      "owner": "M-A",
      "center": {
        "x": 1264,
        "y": 608
      },
      "halfSize": {
        "x": 16,
        "y": 96
      },
      "initiallyClosed": false
    },
    {
      "id": "gate-mb-forward",
      "owner": "M-B",
      "center": {
        "x": 1600,
        "y": 1088
      },
      "halfSize": {
        "x": 16,
        "y": 96
      },
      "initiallyClosed": false
    },
    {
      "id": "gate-mc-forward",
      "owner": "M-C",
      "center": {
        "x": 1888,
        "y": 832
      },
      "halfSize": {
        "x": 16,
        "y": 96
      },
      "initiallyClosed": false
    },
    {
      "id": "gate-elite-forward",
      "owner": "improperSearchDaemon",
      "center": {
        "x": 1904,
        "y": 576
      },
      "halfSize": {
        "x": 16,
        "y": 80
      },
      "initiallyClosed": true
    },
    {
      "id": "gate-boss-extraction",
      "owner": "algorithmicModerate",
      "center": {
        "x": 2048,
        "y": 384
      },
      "halfSize": {
        "x": 96,
        "y": 16
      },
      "initiallyClosed": true
    }
  ],
  "encounterTriggers": [
    {
      "id": "trigger-M-A",
      "encounterId": "M-A",
      "center": {
        "x": 960,
        "y": 576
      },
      "halfSize": {
        "x": 96,
        "y": 96
      }
    },
    {
      "id": "trigger-M-B",
      "encounterId": "M-B",
      "center": {
        "x": 1280,
        "y": 1088
      },
      "halfSize": {
        "x": 96,
        "y": 96
      }
    },
    {
      "id": "trigger-M-C",
      "encounterId": "M-C",
      "center": {
        "x": 1664,
        "y": 832
      },
      "halfSize": {
        "x": 96,
        "y": 96
      }
    },
    {
      "id": "trigger-elite",
      "encounterId": "improperSearchDaemon",
      "center": {
        "x": 1792,
        "y": 768
      },
      "halfSize": {
        "x": 80,
        "y": 80
      }
    },
    {
      "id": "trigger-boss",
      "encounterId": "algorithmicModerate",
      "center": {
        "x": 1984,
        "y": 640
      },
      "halfSize": {
        "x": 96,
        "y": 96
      }
    }
  ],
  "enemySpawnSockets": {
    "M-A": [
      {
        "id": "ma-01",
        "x": 832,
        "y": 512
      },
      {
        "id": "ma-02",
        "x": 896,
        "y": 768
      },
      {
        "id": "ma-03",
        "x": 1088,
        "y": 832
      },
      {
        "id": "ma-04",
        "x": 1216,
        "y": 576
      },
      {
        "id": "ma-05",
        "x": 960,
        "y": 448
      },
      {
        "id": "ma-06",
        "x": 1152,
        "y": 448
      }
    ],
    "M-B": [
      {
        "id": "mb-01",
        "x": 1024,
        "y": 1088
      },
      {
        "id": "mb-02",
        "x": 1088,
        "y": 1408
      },
      {
        "id": "mb-03",
        "x": 1280,
        "y": 1344
      },
      {
        "id": "mb-04",
        "x": 1472,
        "y": 1216
      },
      {
        "id": "mb-05",
        "x": 1600,
        "y": 1152
      },
      {
        "id": "mb-06",
        "x": 1536,
        "y": 896
      },
      {
        "id": "mb-07",
        "x": 1280,
        "y": 832
      },
      {
        "id": "mb-08",
        "x": 1152,
        "y": 896
      }
    ],
    "M-C": [
      {
        "id": "mc-01",
        "x": 1472,
        "y": 768
      },
      {
        "id": "mc-02",
        "x": 1536,
        "y": 1088
      },
      {
        "id": "mc-03",
        "x": 1664,
        "y": 1024
      },
      {
        "id": "mc-04",
        "x": 1856,
        "y": 1088
      },
      {
        "id": "mc-05",
        "x": 1920,
        "y": 960
      },
      {
        "id": "mc-06",
        "x": 1856,
        "y": 704
      },
      {
        "id": "mc-07",
        "x": 1728,
        "y": 640
      },
      {
        "id": "mc-08",
        "x": 1536,
        "y": 640
      }
    ]
  },
  "eliteSpawn": {
    "id": "elite-01",
    "x": 1792,
    "y": 832
  },
  "bossSpawn": {
    "id": "boss-01",
    "x": 2048,
    "y": 768
  },
  "extractionPressureSockets": [
    {
      "id": "xp-01",
      "x": 1920,
      "y": 320
    },
    {
      "id": "xp-02",
      "x": 2176,
      "y": 320
    },
    {
      "id": "xp-03",
      "x": 1920,
      "y": 96
    },
    {
      "id": "xp-04",
      "x": 2176,
      "y": 96
    }
  ],
  "captainCameraEmitters": [
    {
      "id": "captain-emitter-01",
      "x": 1888,
      "y": 832,
      "headingMilliDegrees": 315000,
      "rangeUnits": 320,
      "fieldAngleMilliDegrees": 70000
    },
    {
      "id": "captain-emitter-02",
      "x": 2208,
      "y": 832,
      "headingMilliDegrees": 225000,
      "rangeUnits": 320,
      "fieldAngleMilliDegrees": 70000
    },
    {
      "id": "captain-emitter-03",
      "x": 2048,
      "y": 448,
      "headingMilliDegrees": 90000,
      "rangeUnits": 320,
      "fieldAngleMilliDegrees": 70000
    }
  ],
  "cameraSockets": [
    {
      "socketId": "cam-z02-a",
      "zoneId": "Z-02",
      "position": {
        "x": 448,
        "y": 320
      },
      "headingMilliDegrees": 45000,
      "rangeUnits": 300,
      "fieldAngleMilliDegrees": 60000,
      "allowedHousingFamilies": [
        "trafficReader",
        "temporarySensorMast"
      ],
      "tutorialEligible": true,
      "returnVisible": true,
      "enabled": true,
      "incompatibleSocketIds": [
        "cam-z02-d"
      ]
    },
    {
      "socketId": "cam-z02-b",
      "zoneId": "Z-02",
      "position": {
        "x": 640,
        "y": 256
      },